{
  "employee": {
    "id": "emp-dispatch-001",
    "name": "Morgan Price",
    "initials": "MP",
    "role": "Dispatcher",
    "department": "Communications",
    "shiftGroup": "A Days"
  },
  "summary": {
    "totalEvents": 14,
    "profileEvents": 3,
    "requestEvents": 4,
    "scheduleEvents": 3,
    "systemEvents": 2,
    "lastEvent": "2026-06-13 15:42"
  },
  "filters": [
    "All",
    "Profile",
    "Schedule",
    "Requests",
    "Open Shifts",
    "Trades",
    "Training",
    "Benefits",
    "Eligibility",
    "System"
  ],
  "events": [
    {
      "when": "2026-06-13 15:42",
      "category": "Profile",
      "actor": "Morgan Price",
      "actorType": "Employee",
      "title": "Submitted personal cell update",
      "description": "Requested change to personal cell number.",
      "oldValue": "815-555-0122",
      "newValue": "815-555-0194",
      "reason": "Employee self-service update",
      "visibility": "Admin/Supervisor"
    },
    {
      "when": "2026-06-13 14:20",
      "category": "Requests",
      "actor": "Sgt. Dana Smith",
      "actorType": "Supervisor",
      "title": "Approved vacation request",
      "description": "Approved 8 hours vacation after coverage check passed.",
      "oldValue": "Pending",
      "newValue": "Approved",
      "reason": "Coverage remained above minimum",
      "visibility": "Admin/Supervisor"
    },
    {
      "when": "2026-06-12 18:05",
      "category": "Training",
      "actor": "Lt. Casey Jordan",
      "actorType": "Admin",
      "title": "Added Fire Dispatcher certification",
      "description": "Employee became eligible for Fire Dispatcher assignments.",
      "oldValue": "Not qualified",
      "newValue": "Active credential",
      "reason": "Training record completed",
      "visibility": "Admin/Supervisor"
    },
    {
      "when": "2026-06-12 09:14",
      "category": "Open Shifts",
      "actor": "System",
      "actorType": "System",
      "title": "Skipped for open OT recommendation",
      "description": "Employee was skipped for a Fire Dispatcher OT slot due to rest rule preview.",
      "oldValue": "Eligible",
      "newValue": "Warning",
      "reason": "Minimum rest warning",
      "visibility": "Admin/Supervisor"
    },
    {
      "when": "2026-06-11 21:30",
      "category": "Trades",
      "actor": "Sgt. Dana Smith",
      "actorType": "Supervisor",
      "title": "Rejected shift trade",
      "description": "Trade would place accepting employee below required qualification.",
      "oldValue": "Pending review",
      "newValue": "Rejected",
      "reason": "Missing Fire Dispatcher credential",
      "visibility": "Admin/Supervisor"
    },
    {
      "when": "2026-06-10 08:00",
      "category": "Schedule",
      "actor": "Scheduling Admin",
      "actorType": "Admin",
      "title": "Assigned to A Days pattern",
      "description": "Employee assignment pattern updated for the upcoming pay cycle.",
      "oldValue": "Unassigned",
      "newValue": "A Days 2-2-3",
      "reason": "Quarterly schedule update",
      "visibility": "Admin/Supervisor"
    },
    {
      "when": "2026-06-09 16:12",
      "category": "Benefits",
      "actor": "Payroll Admin",
      "actorType": "Admin",
      "title": "Adjusted sick bank",
      "description": "Manual sick bank correction posted to ledger.",
      "oldValue": "72 hours",
      "newValue": "80 hours",
      "reason": "Carryover correction",
      "visibility": "Admin/Supervisor"
    },
    {
      "when": "2026-06-08 10:22",
      "category": "Eligibility",
      "actor": "System",
      "actorType": "System",
      "title": "Eligibility warning created",
      "description": "EMD certification will expire soon and may affect future assignments.",
      "oldValue": "Active",
      "newValue": "Expiring soon",
      "reason": "30-day expiration threshold",
      "visibility": "Admin/Supervisor"
    }
  ],
  "policy": [
    {
      "label": "Employee View",
      "value": "Own activity only"
    },
    {
      "label": "Supervisor View",
      "value": "Assigned employees/groups"
    },
    {
      "label": "Admin View",
      "value": "All employee timelines"
    },
    {
      "label": "Retention",
      "value": "Agency policy controlled"
    }
  ]
}